bacteria,rhos
k__Bacteria; p__Firmicutes; c__Clostridia; o__Clostridiales; f__Clostridiaceae; g__SMB53,-0.20241443080738702
k__Bacteria; p__Actinobacteria; c__Actinobacteria; o__Bifidobacteriales; f__Bifidobacteriaceae; g__Bifidobacterium,-0.1608862568687078
k__Bacteria; p__Firmicutes; c__Clostridia; o__Clostridiales; f__Veillonellaceae; g__Megasphaera,-0.13274531751265223
k__Bacteria; p__Firmicutes; c__Clostridia; o__Clostridiales; f__Ruminococcaceae; g__Faecalibacterium,-0.1277928050979491
k__Bacteria; p__Bacteroidetes; c__Bacteroidia; o__Bacteroidales; f__Prevotellaceae; g__Prevotella,0.15161186689826373
k__Bacteria; p__Firmicutes; c__Clostridia; o__Clostridiales; f__Clostridiaceae; g__Sarcina,0.15672422240286887
k__Archaea; p__Euryarchaeota; c__Methanobacteria; o__Methanobacteriales; f__Methanobacteriaceae; g__Methanobrevibacter,0.16498552536510697
k__Bacteria; p__Actinobacteria; c__Coriobacteriia; o__Coriobacteriales; f__Coriobacteriaceae; g__Eggerthella,0.1793040454949898
